Target (Gene),Action Type,Action,Drug Name,Specific Disease,num_drugs,num_diseases,Broad Category,maxClinicalStage,immune_indication
PDE4C,INHIBITOR,"3',5'-cyclic phosphodiesterase inhibitor; Equilibrative nucleoside transporter 1 inhibitor; Phosphodiesterase 10A inhibitor; Phosphodiesterase 3A inhibitor; Phosphodiesterase 4 inhibitor; Phosphodiesterase 5A inhibitor; Phosphodiesterase 3 inhibitor; Phosphodiesterase 4 inhibitor; Phosphodiesterase 4 inhibitor",APREMILAST; CRISABOROLE; DIPYRIDAMOLE; ENSIFENTRINE; IBUDILAST; ROFLUMILAST,B-cell chronic lymphocytic leukemia; Castleman disease; Waldenstrom macroglobulinemia; allergic asthma; allergic contact dermatitis; allergic rhinitis; ankylosing spondylitis; atopic eczema; cutaneous lupus erythematosus; diffuse large B-cell lymphoma; discoid lupus erythematosus; follicular lymphoma; immune system disorder; localized scleroderma; mantle cell lymphoma; multiple sclerosis; palmoplantar pustulosis; plasma cell myeloma; psoriasis; psoriasis vulgaris; psoriasis-related juvenile idiopathic arthritis; psoriatic arthritis; rheumatoid arthritis; ulcerative colitis; vitiligo,6,25,immune system disorder,APPROVAL,1
PDE4C,ANTAGONIST; INHIBITOR,"Adenosine A2 receptor antagonist; 3',5'-cyclic phosphodiesterase inhibitor; Adenosine receptor antagonist; Phosphodiesterase 3 inhibitor; Phosphodiesterase 4 inhibitor",AMINOPHYLLINE; PENTOXIFYLLINE,AIDS; B-cell chronic lymphocytic leukemia; inflammatory bowel disease; lymphedema; rheumatoid arthritis; type 1 diabetes mellitus; ulcerative colitis,2,7,immune system disorder,APPROVAL,1
PDE4C,INHIBITOR; ANTAGONIST,Phosphodiesterase 4 inhibitor; Adenosine receptor antagonist; Phosphodiesterase 3 inhibitor,THEOPHYLLINE,B-cell chronic lymphocytic leukemia; allergic rhinitis,1,2,immune system disorder,APPROVAL,1
TUBB2B,BINDING AGENT; INHIBITOR,Receptor protein-tyrosine kinase erbB-2 binding agent; Tubulin inhibitor; Tumor necrosis factor receptor superfamily member 17 binding agent; Tubulin inhibitor,BELANTAMAB MAFODOTIN; TRASTUZUMAB EMTANSINE,plasma cell myeloma; smoldering plasma cell myeloma,2,2,immune system disorder,APPROVAL,1
TUBB2B,INHIBITOR,Tubulin inhibitor,COLCHICINE; DOCETAXEL; IXABEPILONE; PACLITAXEL; VINBLASTINE; VINBLASTINE SULFATE; VINCRISTINE; VINCRISTINE SULFATE; VINORELBINE,"AIDS; B-cell acute lymphoblastic leukemia; B-cell adult acute lymphocytic leukemia; B-cell childhood acute lymphoblastic leukemia; B-cell chronic lymphocytic leukemia; B-cell non-Hodgkin lymphoma; Burkitt lymphoma; Castleman disease; Hashimoto thyroiditis; Langerhans cell histiocytosis; MALT lymphoma; Postpericardiotomy Syndrome; T-cell acute lymphoblastic leukemia; T-cell adult acute lymphocytic leukemia; Waldenstrom macroglobulinemia; acquired polycythemia vera; acute graft versus host disease; acute leukemia of ambiguous lineage; acute myeloid leukemia; acute promyelocytic leukemia; adult T-cell leukemia/lymphoma; aggressive B-cell non-Hodgkin lymphoma; autoimmune hemolytic anemia; autoimmune thrombocytopenic purpura; autoimmune thyroid disease; central nervous system non-hodgkin lymphoma; chronic myelogenous leukemia, BCR-ABL1 positive; chronic myelomonocytic leukemia; diffuse large B-cell lymphoma; early T cell progenitor acute lymphoblastic leukemia; familial Mediterranean fever; follicular lymphoma; hemophagocytic syndrome; high grade B-cell lymphoma; indolent B-cell non-Hodgkin lymphoma; lymphoproliferative syndrome; mantle cell lymphoma; marginal zone lymphoma; metastatic malignant neoplasm in the lymph nodes; mixed phenotype acute leukemia; neoplasm of mature B-cells; plasma cell myeloma; precursor B-cell acute lymphoblastic leukemia; primary central nervous system lymphoma; primary effusion lymphoma; primary myelofibrosis; psoriasis; psoriasis vulgaris; reticulum cell sarcoma; rheumatoid arthritis; thymic carcinoma; thymic epithelial neoplasm; thymoma; tonsil carcinoma; type 1 diabetes mellitus",9,55,immune system disorder,APPROVAL,1
TUBB2B,INHIBITOR; BINDING AGENT,Tubulin inhibitor; B-cell antigen receptor complex-associated protein beta chain binding agent; Tubulin inhibitor; Tumor necrosis factor receptor superfamily member 8 binding agent,BRENTUXIMAB VEDOTIN; POLATUZUMAB VEDOTIN,B-cell chronic lymphocytic leukemia; B-cell non-Hodgkin lymphoma; Burkitt lymphoma; acute myeloid leukemia; adult T-cell leukemia/lymphoma; diffuse large B-cell lymphoma; diffuse large B-cell lymphoma of the central nervous system; diffuse scleroderma; follicular lymphoma; graft versus host disease; high grade B-cell lymphoma; mantle cell lymphoma; marginal zone lymphoma; mast cell leukemia; systemic lupus erythematosus; systemic mastocytosis; systemic sclerosis,2,17,immune system disorder,APPROVAL,1
KCNA3,BLOCKER,Voltage-gated potassium channel blocker,AMIFAMPRIDINE; AMIFAMPRIDINE PHOSPHATE; DALFAMPRIDINE; GUANIDINE HYDROCHLORIDE,Guillain-Barre syndrome; autoimmune disease; autoimmune disorder of the nervous system; immune system disorder; multiple sclerosis; myasthenia gravis,4,6,immune system disorder,APPROVAL,1
PSMB5,INHIBITOR,26S proteasome inhibitor,BORTEZOMIB; BORTEZOMIB D-MANNITOL; CARFILZOMIB; IXAZOMIB; IXAZOMIB CITRATE,"AIDS; B-cell adult acute lymphocytic leukemia; B-cell childhood acute lymphoblastic leukemia; B-cell chronic lymphocytic leukemia; B-cell non-Hodgkin lymphoma; Burkitt lymphoma; Evans syndrome; MALT lymphoma; POEMS syndrome; T-cell acute lymphoblastic leukemia; T-cell adult acute lymphocytic leukemia; T-cell prolymphocytic leukemia; Waldenstrom macroglobulinemia; acquired adult-onset immunodeficiency; acute graft versus host disease; acute myeloid leukemia; acute myeloid leukemia by FAB classification; acute promyelocytic leukemia; adult T-cell leukemia/lymphoma; autoimmune encephalitis; autoimmune hemolytic anemia; autoimmune thrombocytopenic purpura; bone marrow cancer; chronic graft versus host disease; chronic myelogenous leukemia, BCR-ABL1 positive; chronic myelomonocytic leukemia; cold agglutinin disease; diffuse large B-cell lymphoma; follicular lymphoma; graft versus host disease; indolent B-cell non-Hodgkin lymphoma; lymphoplasmacytic lymphoma; mantle cell lymphoma; marginal zone lymphoma; mastocytosis; mixed phenotype acute leukemia; multiple sclerosis; myasthenia gravis; myelofibrosis; myeloid leukemia; neoplasm of mature B-cells; plasma cell leukemia; plasma cell myeloma; plasmacytoma; precursor B-cell acute lymphoblastic leukemia; primary effusion lymphoma; rheumatoid arthritis; smoldering plasma cell myeloma; systemic lupus erythematosus; systemic sclerosis",5,50,immune system disorder,APPROVAL,1
TUBB3,INHIBITOR,Tubulin inhibitor,COLCHICINE; DOCETAXEL; IXABEPILONE; PACLITAXEL; VINBLASTINE; VINBLASTINE SULFATE; VINCRISTINE; VINCRISTINE SULFATE; VINORELBINE,"AIDS; B-cell acute lymphoblastic leukemia; B-cell adult acute lymphocytic leukemia; B-cell childhood acute lymphoblastic leukemia; B-cell chronic lymphocytic leukemia; B-cell non-Hodgkin lymphoma; Burkitt lymphoma; Castleman disease; Hashimoto thyroiditis; Langerhans cell histiocytosis; MALT lymphoma; Postpericardiotomy Syndrome; T-cell acute lymphoblastic leukemia; T-cell adult acute lymphocytic leukemia; Waldenstrom macroglobulinemia; acquired polycythemia vera; acute graft versus host disease; acute leukemia of ambiguous lineage; acute myeloid leukemia; acute promyelocytic leukemia; adult T-cell leukemia/lymphoma; aggressive B-cell non-Hodgkin lymphoma; autoimmune hemolytic anemia; autoimmune thrombocytopenic purpura; autoimmune thyroid disease; central nervous system non-hodgkin lymphoma; chronic myelogenous leukemia, BCR-ABL1 positive; chronic myelomonocytic leukemia; diffuse large B-cell lymphoma; early T cell progenitor acute lymphoblastic leukemia; familial Mediterranean fever; follicular lymphoma; hemophagocytic syndrome; high grade B-cell lymphoma; indolent B-cell non-Hodgkin lymphoma; lymphoproliferative syndrome; mantle cell lymphoma; marginal zone lymphoma; metastatic malignant neoplasm in the lymph nodes; mixed phenotype acute leukemia; neoplasm of mature B-cells; plasma cell myeloma; precursor B-cell acute lymphoblastic leukemia; primary central nervous system lymphoma; primary effusion lymphoma; primary myelofibrosis; psoriasis; psoriasis vulgaris; reticulum cell sarcoma; rheumatoid arthritis; thymic carcinoma; thymic epithelial neoplasm; thymoma; tonsil carcinoma; type 1 diabetes mellitus",9,55,immune system disorder,APPROVAL,1
TUBB3,BINDING AGENT; INHIBITOR,Receptor protein-tyrosine kinase erbB-2 binding agent; Tubulin inhibitor; Tumor necrosis factor receptor superfamily member 17 binding agent; Tubulin inhibitor,BELANTAMAB MAFODOTIN; TRASTUZUMAB EMTANSINE,plasma cell myeloma; smoldering plasma cell myeloma,2,2,immune system disorder,APPROVAL,1
TUBB3,INHIBITOR; BINDING AGENT,Tubulin inhibitor; B-cell antigen receptor complex-associated protein beta chain binding agent; Tubulin inhibitor; Tumor necrosis factor receptor superfamily member 8 binding agent,BRENTUXIMAB VEDOTIN; POLATUZUMAB VEDOTIN,B-cell chronic lymphocytic leukemia; B-cell non-Hodgkin lymphoma; Burkitt lymphoma; acute myeloid leukemia; adult T-cell leukemia/lymphoma; diffuse large B-cell lymphoma; diffuse large B-cell lymphoma of the central nervous system; diffuse scleroderma; follicular lymphoma; graft versus host disease; high grade B-cell lymphoma; mantle cell lymphoma; marginal zone lymphoma; mast cell leukemia; systemic lupus erythematosus; systemic mastocytosis; systemic sclerosis,2,17,immune system disorder,APPROVAL,1
PSMB11,INHIBITOR,26S proteasome inhibitor,BORTEZOMIB; BORTEZOMIB D-MANNITOL; CARFILZOMIB; IXAZOMIB; IXAZOMIB CITRATE,"AIDS; B-cell adult acute lymphocytic leukemia; B-cell childhood acute lymphoblastic leukemia; B-cell chronic lymphocytic leukemia; B-cell non-Hodgkin lymphoma; Burkitt lymphoma; Evans syndrome; MALT lymphoma; POEMS syndrome; T-cell acute lymphoblastic leukemia; T-cell adult acute lymphocytic leukemia; T-cell prolymphocytic leukemia; Waldenstrom macroglobulinemia; acquired adult-onset immunodeficiency; acute graft versus host disease; acute myeloid leukemia; acute myeloid leukemia by FAB classification; acute promyelocytic leukemia; adult T-cell leukemia/lymphoma; autoimmune encephalitis; autoimmune hemolytic anemia; autoimmune thrombocytopenic purpura; bone marrow cancer; chronic graft versus host disease; chronic myelogenous leukemia, BCR-ABL1 positive; chronic myelomonocytic leukemia; cold agglutinin disease; diffuse large B-cell lymphoma; follicular lymphoma; graft versus host disease; indolent B-cell non-Hodgkin lymphoma; lymphoplasmacytic lymphoma; mantle cell lymphoma; marginal zone lymphoma; mastocytosis; mixed phenotype acute leukemia; multiple sclerosis; myasthenia gravis; myelofibrosis; myeloid leukemia; neoplasm of mature B-cells; plasma cell leukemia; plasma cell myeloma; plasmacytoma; precursor B-cell acute lymphoblastic leukemia; primary effusion lymphoma; rheumatoid arthritis; smoldering plasma cell myeloma; systemic lupus erythematosus; systemic sclerosis",5,50,immune system disorder,APPROVAL,1
KCNA5,BLOCKER,Voltage-gated potassium channel blocker,AMIFAMPRIDINE; AMIFAMPRIDINE PHOSPHATE; DALFAMPRIDINE; GUANIDINE HYDROCHLORIDE,Guillain-Barre syndrome; autoimmune disease; autoimmune disorder of the nervous system; immune system disorder; multiple sclerosis; myasthenia gravis,4,6,immune system disorder,APPROVAL,1
PSMA7,INHIBITOR,26S proteasome inhibitor,BORTEZOMIB; BORTEZOMIB D-MANNITOL; CARFILZOMIB; IXAZOMIB; IXAZOMIB CITRATE,"AIDS; B-cell adult acute lymphocytic leukemia; B-cell childhood acute lymphoblastic leukemia; B-cell chronic lymphocytic leukemia; B-cell non-Hodgkin lymphoma; Burkitt lymphoma; Evans syndrome; MALT lymphoma; POEMS syndrome; T-cell acute lymphoblastic leukemia; T-cell adult acute lymphocytic leukemia; T-cell prolymphocytic leukemia; Waldenstrom macroglobulinemia; acquired adult-onset immunodeficiency; acute graft versus host disease; acute myeloid leukemia; acute myeloid leukemia by FAB classification; acute promyelocytic leukemia; adult T-cell leukemia/lymphoma; autoimmune encephalitis; autoimmune hemolytic anemia; autoimmune thrombocytopenic purpura; bone marrow cancer; chronic graft versus host disease; chronic myelogenous leukemia, BCR-ABL1 positive; chronic myelomonocytic leukemia; cold agglutinin disease; diffuse large B-cell lymphoma; follicular lymphoma; graft versus host disease; indolent B-cell non-Hodgkin lymphoma; lymphoplasmacytic lymphoma; mantle cell lymphoma; marginal zone lymphoma; mastocytosis; mixed phenotype acute leukemia; multiple sclerosis; myasthenia gravis; myelofibrosis; myeloid leukemia; neoplasm of mature B-cells; plasma cell leukemia; plasma cell myeloma; plasmacytoma; precursor B-cell acute lymphoblastic leukemia; primary effusion lymphoma; rheumatoid arthritis; smoldering plasma cell myeloma; systemic lupus erythematosus; systemic sclerosis",5,50,immune system disorder,APPROVAL,1
ADRA1D,AGONIST,Adrenergic receptor agonist; Adrenergic receptor alpha agonist; Adrenergic receptor alpha-1 agonist,ALFUZOSIN; DROXIDOPA; EPHEDRINE HYDROCHLORIDE; EPINEPHRINE; NAPHAZOLINE; NAPHAZOLINE HYDROCHLORIDE; OXYMETAZOLINE; OXYMETAZOLINE HYDROCHLORIDE; PHENYLEPHRINE; PHENYLEPHRINE HYDROCHLORIDE; TETRAHYDROZOLINE; XYLOMETAZOLINE,allergic disease; allergic rhinitis; anaphylaxis; atopic conjunctivitis; eye allergy; multiple sclerosis; myalgic encephalomeyelitis/chronic fatigue syndrome; seasonal allergic rhinitis; type 1 diabetes mellitus; type III hypersensitivity disease,12,10,immune system disorder,APPROVAL,1
ADRA1D,ANTAGONIST,Adrenergic receptor alpha antagonist; Adrenergic receptor alpha-1 antagonist; Adrenergic receptor beta antagonist,CARVEDILOL; PHENTOLAMINE,anaphylaxis; rheumatoid arthritis; type 1 diabetes mellitus,2,3,immune system disorder,APPROVAL,1
TPO,INHIBITOR,Thyroid peroxidase inhibitor; Thyroid peroxidase inhibitor; Type I iodothyronine deiodinase (Type-I 5'-deiodinase) (DIOI) (Type 1 DI) (5DI) inhibitor,CARBIMAZOLE; METHIMAZOLE; PROPYLTHIOURACIL,Graves disease; Graves ophthalmopathy; Hashimoto thyroiditis,3,3,immune system disorder,APPROVAL,1
SEM1,INHIBITOR,26S proteasome inhibitor,BORTEZOMIB; BORTEZOMIB D-MANNITOL; CARFILZOMIB; IXAZOMIB; IXAZOMIB CITRATE,"AIDS; B-cell adult acute lymphocytic leukemia; B-cell childhood acute lymphoblastic leukemia; B-cell chronic lymphocytic leukemia; B-cell non-Hodgkin lymphoma; Burkitt lymphoma; Evans syndrome; MALT lymphoma; POEMS syndrome; T-cell acute lymphoblastic leukemia; T-cell adult acute lymphocytic leukemia; T-cell prolymphocytic leukemia; Waldenstrom macroglobulinemia; acquired adult-onset immunodeficiency; acute graft versus host disease; acute myeloid leukemia; acute myeloid leukemia by FAB classification; acute promyelocytic leukemia; adult T-cell leukemia/lymphoma; autoimmune encephalitis; autoimmune hemolytic anemia; autoimmune thrombocytopenic purpura; bone marrow cancer; chronic graft versus host disease; chronic myelogenous leukemia, BCR-ABL1 positive; chronic myelomonocytic leukemia; cold agglutinin disease; diffuse large B-cell lymphoma; follicular lymphoma; graft versus host disease; indolent B-cell non-Hodgkin lymphoma; lymphoplasmacytic lymphoma; mantle cell lymphoma; marginal zone lymphoma; mastocytosis; mixed phenotype acute leukemia; multiple sclerosis; myasthenia gravis; myelofibrosis; myeloid leukemia; neoplasm of mature B-cells; plasma cell leukemia; plasma cell myeloma; plasmacytoma; precursor B-cell acute lymphoblastic leukemia; primary effusion lymphoma; rheumatoid arthritis; smoldering plasma cell myeloma; systemic lupus erythematosus; systemic sclerosis",5,50,immune system disorder,APPROVAL,1
GABBR1,AGONIST,GABA-B receptor agonist,BACLOFEN,ataxia telangiectasia; multiple sclerosis,1,2,immune system disorder,APPROVAL,1
SLC6A2,INHIBITOR,Dopamine transporter inhibitor; Norepinephrine transporter inhibitor; Norepinephrine transporter inhibitor; Norepinephrine transporter inhibitor; Serotonin transporter inhibitor; Serotonin transporter inhibitor; Norepinephrine transporter inhibitor,AMITRIPTYLINE; ATOMOXETINE; BUPROPION; DESIPRAMINE HYDROCHLORIDE; DOXEPIN HYDROCHLORIDE; DULOXETINE; IMIPRAMINE; METHYLPHENIDATE; METHYLPHENIDATE HYDROCHLORIDE; NORTRIPTYLINE; NORTRIPTYLINE HYDROCHLORIDE; VENLAFAXINE,22q11.2 deletion syndrome; Crohn disease; atopic eczema; inflammatory bowel disease; multiple sclerosis; myalgic encephalomeyelitis/chronic fatigue syndrome; plasma cell myeloma; psoriasis; rheumatoid arthritis; systemic lupus erythematosus; type 1 diabetes mellitus,12,11,immune system disorder,APPROVAL,1
SLC6A2,RELEASING AGENT,Dopamine transporter releasing agent; Norepinephrine transporter releasing agent; Norepinephrine transporter releasing agent,AMPHETAMINE; PHENTERMINE; PSEUDOEPHEDRINE; PSEUDOEPHEDRINE HYDROCHLORIDE; PSEUDOEPHEDRINE SULFATE,allergic disease; allergic rhinitis; multiple sclerosis; perennial allergic rhinitis; seasonal allergic rhinitis; ulcerative colitis; vasomotor rhinitis,5,7,immune system disorder,APPROVAL,1
SLC6A2,RELEASING AGENT; INHIBITOR,Dopamine transporter releasing agent; Norepinephrine transporter releasing agent; Synaptic vesicular amine transporter inhibitor,LISDEXAMFETAMINE,multiple sclerosis; type 1 diabetes mellitus,1,2,immune system disorder,APPROVAL,1
PSMD11,INHIBITOR,26S proteasome inhibitor,BORTEZOMIB; BORTEZOMIB D-MANNITOL; CARFILZOMIB; IXAZOMIB; IXAZOMIB CITRATE,"AIDS; B-cell adult acute lymphocytic leukemia; B-cell childhood acute lymphoblastic leukemia; B-cell chronic lymphocytic leukemia; B-cell non-Hodgkin lymphoma; Burkitt lymphoma; Evans syndrome; MALT lymphoma; POEMS syndrome; T-cell acute lymphoblastic leukemia; T-cell adult acute lymphocytic leukemia; T-cell prolymphocytic leukemia; Waldenstrom macroglobulinemia; acquired adult-onset immunodeficiency; acute graft versus host disease; acute myeloid leukemia; acute myeloid leukemia by FAB classification; acute promyelocytic leukemia; adult T-cell leukemia/lymphoma; autoimmune encephalitis; autoimmune hemolytic anemia; autoimmune thrombocytopenic purpura; bone marrow cancer; chronic graft versus host disease; chronic myelogenous leukemia, BCR-ABL1 positive; chronic myelomonocytic leukemia; cold agglutinin disease; diffuse large B-cell lymphoma; follicular lymphoma; graft versus host disease; indolent B-cell non-Hodgkin lymphoma; lymphoplasmacytic lymphoma; mantle cell lymphoma; marginal zone lymphoma; mastocytosis; mixed phenotype acute leukemia; multiple sclerosis; myasthenia gravis; myelofibrosis; myeloid leukemia; neoplasm of mature B-cells; plasma cell leukemia; plasma cell myeloma; plasmacytoma; precursor B-cell acute lymphoblastic leukemia; primary effusion lymphoma; rheumatoid arthritis; smoldering plasma cell myeloma; systemic lupus erythematosus; systemic sclerosis",5,50,immune system disorder,APPROVAL,1
POLE2,INHIBITOR,DNA polymerase (alpha/delta/epsilon) inhibitor; DNA polymerase (alpha/delta/epsilon) inhibitor; Ribonucleoside-diphosphate reductase RR1 inhibitor,CLOFARABINE; CYTARABINE; FLUDARABINE PHOSPHATE; GEMCITABINE; GEMCITABINE HYDROCHLORIDE,"B-cell acute lymphoblastic leukemia; B-cell adult acute lymphocytic leukemia; B-cell childhood acute lymphoblastic leukemia; B-cell chronic lymphocytic leukemia; B-cell non-Hodgkin lymphoma; B-cell prolymphocytic leukemia; Burkitt lymphoma; Crohn disease; Fanconi anemia; Langerhans cell histiocytosis; POEMS syndrome; T-cell acute lymphoblastic leukemia; T-cell adult acute lymphocytic leukemia; Waldenstrom macroglobulinemia; acute leukemia of ambiguous lineage; acute monocytic leukemia; acute myeloid leukemia; acute myeloid leukemia by FAB classification; acute promyelocytic leukemia; adult T-cell leukemia/lymphoma; autoimmune disorder of the nervous system; autoimmune hemolytic anemia; autoimmune thrombocytopenic purpura; bone marrow failure syndrome; central nervous system non-hodgkin lymphoma; chronic myelogenous leukemia, BCR-ABL1 positive; chronic myelomonocytic leukemia; diffuse large B-cell lymphoma; diffuse large B-cell lymphoma of the central nervous system; early T cell progenitor acute lymphoblastic leukemia; follicular lymphoma; graft versus host disease; granulocytic sarcoma; hemophagocytic syndrome; high grade B-cell lymphoma; idiopathic hypereosinophilic syndrome; immunodeficiency disease; inborn error of immunity; juvenile myelomonocytic leukemia; lymphoplasmacytic lymphoma; mantle cell lymphoma; mixed phenotype acute leukemia; multiple sclerosis; myelodysplastic/myeloproliferative neoplasm; myelofibrosis; myeloid leukemia; myeloid sarcoma; myeloproliferative neoplasm; neoplasm of mature B-cells; plasma cell leukemia; plasma cell myeloma; precursor B-cell acute lymphoblastic leukemia; primary central nervous system lymphoma; reticulum cell sarcoma; systemic lupus erythematosus; systemic sclerosis; therapy related acute myeloid leukemia and myelodysplastic syndrome; transient myeloproliferative syndrome",5,58,immune system disorder,APPROVAL,1
PSMA5,INHIBITOR,26S proteasome inhibitor,BORTEZOMIB; BORTEZOMIB D-MANNITOL; CARFILZOMIB; IXAZOMIB; IXAZOMIB CITRATE,"AIDS; B-cell adult acute lymphocytic leukemia; B-cell childhood acute lymphoblastic leukemia; B-cell chronic lymphocytic leukemia; B-cell non-Hodgkin lymphoma; Burkitt lymphoma; Evans syndrome; MALT lymphoma; POEMS syndrome; T-cell acute lymphoblastic leukemia; T-cell adult acute lymphocytic leukemia; T-cell prolymphocytic leukemia; Waldenstrom macroglobulinemia; acquired adult-onset immunodeficiency; acute graft versus host disease; acute myeloid leukemia; acute myeloid leukemia by FAB classification; acute promyelocytic leukemia; adult T-cell leukemia/lymphoma; autoimmune encephalitis; autoimmune hemolytic anemia; autoimmune thrombocytopenic purpura; bone marrow cancer; chronic graft versus host disease; chronic myelogenous leukemia, BCR-ABL1 positive; chronic myelomonocytic leukemia; cold agglutinin disease; diffuse large B-cell lymphoma; follicular lymphoma; graft versus host disease; indolent B-cell non-Hodgkin lymphoma; lymphoplasmacytic lymphoma; mantle cell lymphoma; marginal zone lymphoma; mastocytosis; mixed phenotype acute leukemia; multiple sclerosis; myasthenia gravis; myelofibrosis; myeloid leukemia; neoplasm of mature B-cells; plasma cell leukemia; plasma cell myeloma; plasmacytoma; precursor B-cell acute lymphoblastic leukemia; primary effusion lymphoma; rheumatoid arthritis; smoldering plasma cell myeloma; systemic lupus erythematosus; systemic sclerosis",5,50,immune system disorder,APPROVAL,1
PRKCA,INHIBITOR,Tyrosine-protein kinase receptor FLT3 inhibitor; Vascular endothelial growth factor receptor 2 inhibitor; Platelet-derived growth factor receptor inhibitor; Protein kinase C (PKC) inhibitor; Stem cell growth factor receptor inhibitor,MIDOSTAURIN,"acute myeloid leukemia; acute myeloid leukemia by FAB classification; aggressive systemic mastocytosis; chronic myelogenous leukemia, BCR-ABL1 positive; juvenile myelomonocytic leukemia; mast cell leukemia; mast cell sarcoma; mastocytosis; myeloid leukemia; myeloid sarcoma; systemic mastocytosis; systemic mastocytosis with an associated clonal hematologic non-mast cell lineage disease",1,12,immune system disorder,APPROVAL,1
NTRK1,INHIBITOR,ALK tyrosine kinase receptor inhibitor; Neurotrophic tyrosine kinase receptor inhibitor; Proto-oncogene tyrosine-protein kinase ROS inhibitor; Discoidin domain-containing receptor 2 inhibitor; Ephrin type-A receptor 2 inhibitor; Fibroblast growth factor receptor 2 inhibitor; MAP kinase p38 beta inhibitor; Platelet-derived growth factor receptor inhibitor; Serine/threonine-protein kinase B-raf inhibitor; Stem cell growth factor receptor inhibitor; Tyrosine-protein kinase TIE-2 inhibitor; Fibroblast growth factor receptor 1 inhibitor; Nerve growth factor receptor Trk-A inhibitor; Serine/threonine-protein kinase RAF inhibitor; Tyrosine-protein kinase ABL inhibitor; Tyrosine-protein kinase FRK inhibitor; Tyrosine-protein kinase receptor RET inhibitor; Vascular endothelial growth factor receptor inhibitor; Nerve growth factor receptor Trk-A inhibitor; Neurotrophic tyrosine kinase receptor type 2 inhibitor; Tyrosine-protein kinase receptor FLT3 inhibitor; NT-3 growth factor receptor inhibitor; Tyrosine-protein kinase JAK2 inhibitor; Tyrosine-protein kinase receptor RET inhibitor; Neurotrophic tyrosine kinase receptor inhibitor,ENTRECTINIB; LAROTRECTINIB; LESTAURTINIB; REGORAFENIB,acquired polycythemia vera; acute myeloid leukemia; acute myeloid leukemia by FAB classification; essential thrombocythemia; myelofibrosis; myeloid leukemia; myeloproliferative neoplasm; plasma cell myeloma; psoriasis; psoriasis vulgaris; thymic carcinoma; thymoma,4,12,immune system disorder,APPROVAL,1
