Target (Gene),Action Type,Action,Drug Name,Specific Disease,num_drugs,num_diseases,Broad Category,maxClinicalStage,immune_indication
RET,INHIBITOR,Coiled-coil domain-containing protein 6/Tyrosine-protein kinase receptor RET inhibitor; Tyrosine-protein kinase receptor RET inhibitor; Kinesin-1 heavy chain/ Tyrosine-protein kinase receptor RET inhibitor; Discoidin domain-containing receptor 2 inhibitor; Ephrin type-A receptor 2 inhibitor; Fibroblast growth factor receptor 2 inhibitor; MAP kinase p38 beta inhibitor; Platelet-derived growth factor receptor inhibitor; Serine/threonine-protein kinase B-raf inhibitor; Stem cell growth factor receptor inhibitor; Tyrosine-protein kinase TIE-2 inhibitor; Fibroblast growth factor receptor 1 inhibitor; Nerve growth factor receptor Trk-A inhibitor; Serine/threonine-protein kinase RAF inhibitor; Tyrosine-protein kinase ABL inhibitor; Tyrosine-protein kinase FRK inhibitor; Tyrosine-protein kinase receptor RET inhibitor; Vascular endothelial growth factor receptor inhibitor; EML4-ALK inhibitor; Tyrosine-protein kinase receptor RET inhibitor; ALK tyrosine kinase receptor inhibitor; Ephrin receptor inhibitor; Tyrosine-protein kinase BRK inhibitor; Tyrosine-protein kinase receptor RET inhibitor; Vascular endothelial growth factor receptor inhibitor; Epidermal growth factor receptor inhibitor; Tyrosine-protein kinase SRC inhibitor; Tyrosine-protein kinase TIE-2 inhibitor; Macrophage colony stimulating factor receptor inhibitor; Platelet-derived growth factor receptor inhibitor; Stem cell growth factor receptor inhibitor; Tyrosine-protein kinase receptor FLT3 inhibitor; Tyrosine-protein kinase receptor RET inhibitor; Macrophage colony stimulating factor receptor inhibitor; Stem cell growth factor receptor inhibitor; Vascular endothelial growth factor receptor 1 inhibitor; Vascular endothelial growth factor receptor 2 inhibitor; Vascular endothelial growth factor receptor inhibitor; Platelet-derived growth factor receptor alpha inhibitor; Platelet-derived growth factor receptor beta inhibitor; Platelet-derived growth factor receptor inhibitor; Tyrosine-protein kinase receptor FLT3 inhibitor; Tyrosine-protein kinase receptor RET inhibitor; Vascular endothelial growth factor receptor 3 inhibitor; Nerve growth factor receptor Trk-A inhibitor; Neurotrophic tyrosine kinase receptor type 2 inhibitor; Tyrosine-protein kinase receptor FLT3 inhibitor; NT-3 growth factor receptor inhibitor; Tyrosine-protein kinase JAK2 inhibitor; Tyrosine-protein kinase receptor RET inhibitor; Serine/threonine-protein kinase RAF inhibitor; Platelet-derived growth factor receptor beta inhibitor; Serine/threonine-protein kinase B-raf inhibitor; Stem cell growth factor receptor inhibitor; Tyrosine-protein kinase receptor FLT3 inhibitor; Tyrosine-protein kinase receptor RET inhibitor; Vascular endothelial growth factor receptor inhibitor; Vascular endothelial growth factor receptor inhibitor; Macrophage colony stimulating factor receptor inhibitor; Platelet-derived growth factor receptor inhibitor; Stem cell growth factor receptor inhibitor; Tyrosine-protein kinase receptor FLT3 inhibitor; Tyrosine-protein kinase receptor RET inhibitor,ALECTINIB; LESTAURTINIB; QUIZARTINIB; REGORAFENIB; SELPERCATINIB; SORAFENIB; SORAFENIB TOSYLATE; SUNITINIB; SUNITINIB MALATE; VANDETANIB,"B-cell chronic lymphocytic leukemia; acquired polycythemia vera; acute leukemia of ambiguous lineage; acute monocytic leukemia; acute myeloid leukemia; acute myeloid leukemia by FAB classification; acute promyelocytic leukemia; chronic myelogenous leukemia, BCR-ABL1 positive; chronic myelomonocytic leukemia; diffuse large B-cell lymphoma; essential thrombocythemia; mantle cell lymphoma; mixed phenotype acute leukemia; myelodysplastic/myeloproliferative neoplasm; myelofibrosis; myeloid leukemia; myeloproliferative neoplasm; plasma cell myeloma; primary myelofibrosis; psoriasis; psoriasis vulgaris; thymic carcinoma; thymoma; type 1 diabetes mellitus",10,24,immune system disorder,APPROVAL,1
HDAC7,INHIBITOR,Histone deacetylase inhibitor,BELINOSTAT; ENTINOSTAT; GIVINOSTAT; GIVINOSTAT HYDROCHLORIDE; PANOBINOSTAT; PANOBINOSTAT LACTATE; ROMIDEPSIN,"B-cell chronic lymphocytic leukemia; B-cell non-Hodgkin lymphoma; Crohn disease; T-cell acute lymphoblastic leukemia; Waldenstrom macroglobulinemia; acquired polycythemia vera; acute myeloid leukemia; adult T-cell leukemia/lymphoma; chronic myelogenous leukemia, BCR-ABL1 positive; chronic myelomonocytic leukemia; diffuse large B-cell lymphoma; essential thrombocythemia; follicular lymphoma; graft versus host disease; indolent B-cell non-Hodgkin lymphoma; lymphoplasmacytic lymphoma; mantle cell lymphoma; myelofibrosis; plasma cell myeloma; primary myelofibrosis; thymic carcinoma; thymoma",7,22,immune system disorder,APPROVAL,1
EGFR,INHIBITOR,Ephrin receptor inhibitor; Tyrosine-protein kinase BRK inhibitor; Tyrosine-protein kinase receptor RET inhibitor; Vascular endothelial growth factor receptor inhibitor; Epidermal growth factor receptor inhibitor; Tyrosine-protein kinase SRC inhibitor; Tyrosine-protein kinase TIE-2 inhibitor; Epidermal growth factor receptor erbB1 inhibitor; Epidermal growth factor receptor erbB1 inhibitor; Receptor protein-tyrosine kinase erbB-2 inhibitor; Epidermal growth factor receptor erbB1 inhibitor; Receptor protein-tyrosine kinase erbB-2 inhibitor; Receptor protein-tyrosine kinase erbB-4 inhibitor; Receptor protein-tyrosine kinase erbB-4 inhibitor; Epidermal growth factor receptor erbB1 inhibitor; Receptor protein-tyrosine kinase erbB-2 inhibitor,AFATINIB; CETUXIMAB; ERLOTINIB; ERLOTINIB HYDROCHLORIDE; GEFITINIB; LAPATINIB; NERATINIB; NIMOTUZUMAB; OSIMERTINIB; PANITUMUMAB; VANDETANIB,"Erdheim-Chester disease; Langerhans cell histiocytosis; Waldenstrom macroglobulinemia; acquired polycythemia vera; acute myeloid leukemia; chronic myelogenous leukemia, BCR-ABL1 positive; mantle cell lymphoma; neutropenia; plasma cell myeloma; psoriasis; thymic carcinoma; thymoma; tonsil carcinoma",11,13,immune system disorder,APPROVAL,1
KCNA4,BLOCKER,Voltage-gated potassium channel blocker,AMIFAMPRIDINE; AMIFAMPRIDINE PHOSPHATE; DALFAMPRIDINE; GUANIDINE HYDROCHLORIDE,Guillain-Barre syndrome; autoimmune disease; autoimmune disorder of the nervous system; immune system disorder; multiple sclerosis; myasthenia gravis,4,6,immune system disorder,APPROVAL,1
ACVR1,INHIBITOR,Activin receptor type-1 inhibitor; Tyrosine-protein kinase JAK1 inhibitor; Tyrosine-protein kinase JAK2 inhibitor; Activin receptor type-1 inhibitor; Tyrosine-protein kinase JAK2 inhibitor; Tyrosine-protein kinase receptor FLT3 inhibitor; Interleukin-1 receptor-associated kinase 1 inhibitor; Activin receptor type-1 inhibitor; Tyrosine-protein kinase receptor FLT3 inhibitor; Interleukin-1 receptor-associated kinase 1 inhibitor; Tyrosine-protein kinase JAK2 inhibitor,MOMELOTINIB; MOMELOTINIB DIHYDROCHLORIDE MONOHYDRATE; PACRITINIB; PACRITINIB CITRATE,B-cell chronic lymphocytic leukemia; Waldenstrom macroglobulinemia; acquired polycythemia vera; acute myeloid leukemia; chronic graft versus host disease; chronic myelomonocytic leukemia; chronic neutrophilic leukemia; essential thrombocythemia; follicular lymphoma; lymphoplasmacytic lymphoma; lymphoproliferative syndrome; mantle cell lymphoma; marginal zone lymphoma; myelodysplastic/myeloproliferative neoplasm; myelofibrosis; myeloproliferative neoplasm; primary myelofibrosis,4,17,immune system disorder,APPROVAL,1
PSMA6,INHIBITOR,26S proteasome inhibitor,BORTEZOMIB; BORTEZOMIB D-MANNITOL; CARFILZOMIB; IXAZOMIB; IXAZOMIB CITRATE,"AIDS; B-cell adult acute lymphocytic leukemia; B-cell childhood acute lymphoblastic leukemia; B-cell chronic lymphocytic leukemia; B-cell non-Hodgkin lymphoma; Burkitt lymphoma; Evans syndrome; MALT lymphoma; POEMS syndrome; T-cell acute lymphoblastic leukemia; T-cell adult acute lymphocytic leukemia; T-cell prolymphocytic leukemia; Waldenstrom macroglobulinemia; acquired adult-onset immunodeficiency; acute graft versus host disease; acute myeloid leukemia; acute myeloid leukemia by FAB classification; acute promyelocytic leukemia; adult T-cell leukemia/lymphoma; autoimmune encephalitis; autoimmune hemolytic anemia; autoimmune thrombocytopenic purpura; bone marrow cancer; chronic graft versus host disease; chronic myelogenous leukemia, BCR-ABL1 positive; chronic myelomonocytic leukemia; cold agglutinin disease; diffuse large B-cell lymphoma; follicular lymphoma; graft versus host disease; indolent B-cell non-Hodgkin lymphoma; lymphoplasmacytic lymphoma; mantle cell lymphoma; marginal zone lymphoma; mastocytosis; mixed phenotype acute leukemia; multiple sclerosis; myasthenia gravis; myelofibrosis; myeloid leukemia; neoplasm of mature B-cells; plasma cell leukemia; plasma cell myeloma; plasmacytoma; precursor B-cell acute lymphoblastic leukemia; primary effusion lymphoma; rheumatoid arthritis; smoldering plasma cell myeloma; systemic lupus erythematosus; systemic sclerosis",5,50,immune system disorder,APPROVAL,1
CD52,INHIBITOR,CAMPATH-1 antigen inhibitor,ALEMTUZUMAB,"B-cell chronic lymphocytic leukemia; Crohn disease; Familial hemophagocytic lymphohistiocytosis; Fanconi anemia; Langerhans cell histiocytosis; Leukocyte adhesion deficiency type I; Sjogren syndrome; T-cell acute lymphoblastic leukemia; T-cell large granular lymphocyte leukemia; T-cell prolymphocytic leukemia; Waldenstrom macroglobulinemia; Wiskott-Aldrich syndrome; X-linked hyper-IgM syndrome; X-linked lymphoproliferative disease; acute myeloid leukemia; adult T-cell leukemia/lymphoma; antiphospholipid syndrome; autoimmune hemolytic anemia; autoimmune thrombocytopenic purpura; bone marrow failure syndrome; chronic graft versus host disease; chronic granulomatous disease; chronic myelogenous leukemia, BCR-ABL1 positive; common variable immunodeficiency; diffuse large B-cell lymphoma; follicular lymphoma; graft versus host disease; hemophagocytic syndrome; high grade B-cell lymphoma; hyper-IgM syndrome type 1; immune dysregulation-polyendocrinopathy-enteropathy-X-linked syndrome; inborn error of immunity; inherited bone marrow failure syndrome; juvenile myelomonocytic leukemia; leukocyte adhesion deficiency; lymphoplasmacytic lymphoma; mantle cell lymphoma; multiple sclerosis; myeloid leukemia; plasma cell myeloma; relapsing-remitting multiple sclerosis; rheumatoid arthritis; severe combined immunodeficiency; systemic lupus erythematosus; systemic sclerosis; type 1 diabetes mellitus",1,46,immune system disorder,APPROVAL,1
FYN,INHIBITOR,Bcr/Abl fusion protein inhibitor; Ephrin type-A receptor 2 inhibitor; Platelet-derived growth factor receptor beta inhibitor; SRC inhibitor; Stem cell growth factor receptor inhibitor; Tyrosine-protein kinase ABL inhibitor,DASATINIB ANHYDROUS,"B-cell adult acute lymphocytic leukemia; B-cell childhood acute lymphoblastic leukemia; B-cell chronic lymphocytic leukemia; T-cell acute lymphoblastic leukemia; T-cell adult acute lymphocytic leukemia; Waldenstrom macroglobulinemia; acquired polycythemia vera; acute myeloid leukemia; blast phase chronic myelogenous leukemia, BCR-ABL1 positive; chronic myelogenous leukemia, BCR-ABL1 positive; diffuse large B-cell lymphoma; plasma cell myeloma; precursor B-cell acute lymphoblastic leukemia; systemic mastocytosis",1,14,immune system disorder,APPROVAL,1
AHR,AGONIST,Aryl hydrocarbon receptor agonist,TAPINAROF,atopic eczema; cutaneous lupus erythematosus; psoriasis; psoriasis vulgaris,1,4,immune system disorder,APPROVAL,1
FGFR1,INHIBITOR,Discoidin domain-containing receptor 2 inhibitor; Ephrin type-A receptor 2 inhibitor; Fibroblast growth factor receptor 2 inhibitor; MAP kinase p38 beta inhibitor; Platelet-derived growth factor receptor inhibitor; Serine/threonine-protein kinase B-raf inhibitor; Stem cell growth factor receptor inhibitor; Tyrosine-protein kinase TIE-2 inhibitor; Fibroblast growth factor receptor 1 inhibitor; Nerve growth factor receptor Trk-A inhibitor; Serine/threonine-protein kinase RAF inhibitor; Tyrosine-protein kinase ABL inhibitor; Tyrosine-protein kinase FRK inhibitor; Tyrosine-protein kinase receptor RET inhibitor; Vascular endothelial growth factor receptor inhibitor; Fibroblast growth factor receptor 1 inhibitor; Fibroblast growth factor receptor 3 inhibitor; Macrophage colony stimulating factor receptor inhibitor; Platelet-derived growth factor receptor inhibitor; Stem cell growth factor receptor inhibitor; Tyrosine-protein kinase ITK/TSK inhibitor; Tyrosine-protein kinase LCK inhibitor; Vascular endothelial growth factor receptor inhibitor; Fibroblast growth factor receptor 3 inhibitor; Fibroblast growth factor receptor 1 inhibitor; Fibroblast growth factor receptor 2 inhibitor; Fibroblast growth factor receptor inhibitor; Platelet-derived growth factor receptor inhibitor; Vascular endothelial growth factor receptor inhibitor; Fibroblast growth factor receptor inhibitor,ERDAFITINIB; FUTIBATINIB; NINTEDANIB; NINTEDANIB ESYLATE; PAZOPANIB; PEMIGATINIB; REGORAFENIB,acute myeloid leukemia; limited cutaneous systemic sclerosis; lymphedema; myeloproliferative neoplasm; plasma cell myeloma; psoriasis; systemic sclerosis; thymic carcinoma; thymoma,7,9,immune system disorder,APPROVAL,1
CD33,BINDING AGENT,Myeloid cell surface antigen CD33 binding agent,GEMTUZUMAB OZOGAMICIN,"acute myeloid leukemia; acute myeloid leukemia by FAB classification; acute promyelocytic leukemia; chronic myelogenous leukemia, BCR-ABL1 positive; juvenile myelomonocytic leukemia; mixed phenotype acute leukemia; myelofibrosis; myeloid leukemia; myeloproliferative neoplasm",1,9,immune system disorder,APPROVAL,1
CHRM1,AGONIST,Muscarinic acetylcholine receptor M1 agonist; Muscarinic acetylcholine receptor M3 agonist,CEVIMELINE; PILOCARPINE,Sjogren syndrome,2,1,immune system disorder,APPROVAL,1
CHRM1,ANTAGONIST,Muscarinic acetylcholine receptor M1 antagonist; Muscarinic acetylcholine receptor M3 antagonist; Muscarinic acetylcholine receptor M2 antagonist; Muscarinic acetylcholine receptor M3 antagonist; Muscarinic acetylcholine receptor M1 antagonist,ATROPINE; ATROPINE SULFATE; ISOPROPAMIDE IODIDE,allergic rhinitis; seasonal allergic rhinitis,3,2,immune system disorder,APPROVAL,1
CYSLTR1,ANTAGONIST,Cysteinyl leukotriene receptor 1 antagonist,MONTELUKAST; MONTELUKAST SODIUM,allergic asthma; allergic rhinitis; atopic IgE-mediated allergic disorder; atopic eczema; chronic graft versus host disease; perennial allergic rhinitis; rheumatoid arthritis; seasonal allergic rhinitis,2,8,immune system disorder,APPROVAL,1
MIF,INHIBITOR,Cyclooxygenase-2 inhibitor; E3 ubiquitin ligase TRAF3IP2 inhibitor; Macrophage migration inhibitory factor inhibitor,IGURATIMOD,Sjogren syndrome; autoimmune thrombocytopenic purpura; chronic graft versus host disease; immunoglobulin G4-related sclerosing disease; rheumatoid arthritis; systemic sclerosis,1,6,immune system disorder,APPROVAL,1
IL23A,INHIBITOR,Interleukin-12 inhibitor; Interleukin-23 inhibitor; Interleukin-23 inhibitor,BRIAKINUMAB; GUSELKUMAB; MIRIKIZUMAB; RISANKIZUMAB; TILDRAKIZUMAB; USTEKINUMAB,Crohn disease; Hailey-Hailey disease; Netherton syndrome; Sjogren syndrome; ankylosing spondylitis; atopic eczema; bullous pemphigoid; celiac disease; common variable immunodeficiency; generalized pustular psoriasis; immune system disorder; inflammatory bowel disease; leukocyte adhesion deficiency 1; multiple sclerosis; palmoplantar pustulosis; psoriasis; psoriasis vulgaris; psoriasis-related juvenile idiopathic arthritis; psoriatic arthritis; pustular psoriasis; rheumatoid arthritis; systemic lupus erythematosus; systemic sclerosis; type 1 diabetes mellitus; ulcerative colitis; vitiligo,6,26,immune system disorder,APPROVAL,1
KCNC4,BLOCKER,Voltage-gated potassium channel blocker,AMIFAMPRIDINE; AMIFAMPRIDINE PHOSPHATE; DALFAMPRIDINE; GUANIDINE HYDROCHLORIDE,Guillain-Barre syndrome; autoimmune disease; autoimmune disorder of the nervous system; immune system disorder; multiple sclerosis; myasthenia gravis,4,6,immune system disorder,APPROVAL,1
ADRA2C,AGONIST,Adrenergic receptor agonist; Adrenergic receptor alpha agonist; Adrenergic receptor alpha-2 agonist,BRIMONIDINE; BRIMONIDINE TARTRATE; CLONIDINE; DROXIDOPA; EPHEDRINE HYDROCHLORIDE; EPINEPHRINE; GUANABENZ; METHYLDOPA; NAPHAZOLINE; NAPHAZOLINE HYDROCHLORIDE; OXYMETAZOLINE; OXYMETAZOLINE HYDROCHLORIDE; TETRAHYDROZOLINE; TIZANIDINE; XYLOMETAZOLINE,allergic disease; allergic rhinitis; anaphylaxis; atopic conjunctivitis; atopic eczema; eye allergy; graft versus host disease; multiple sclerosis; myalgic encephalomeyelitis/chronic fatigue syndrome; seasonal allergic rhinitis; type 1 diabetes mellitus; type III hypersensitivity disease,15,12,immune system disorder,APPROVAL,1
ADRA2C,ANTAGONIST,Adrenergic receptor alpha antagonist; Serotonin 2a (5-HT2a) receptor antagonist; Serotonin 2c (5-HT2c) receptor antagonist; Adrenergic receptor alpha-2 antagonist,MIRTAZAPINE; PHENTOLAMINE,inflammatory bowel disease; type 1 diabetes mellitus,2,2,immune system disorder,APPROVAL,1
IGF1R,ANTAGONIST,Insulin-like growth factor I receptor antagonist,TEPROTUMUMAB,Graves disease; Graves ophthalmopathy; diffuse scleroderma,1,3,immune system disorder,APPROVAL,1
IGF1R,AGONIST,Insulin-like growth factor I receptor agonist,MECASERMIN,T-B+ severe combined immunodeficiency due to gamma chain deficiency; multiple sclerosis; type 1 diabetes mellitus,1,3,immune system disorder,APPROVAL,1
CHRM3,ANTAGONIST,Muscarinic acetylcholine receptor M1 antagonist; Muscarinic acetylcholine receptor M3 antagonist; Muscarinic acetylcholine receptor M2 antagonist; Muscarinic acetylcholine receptor M3 antagonist; Muscarinic acetylcholine receptor M2 antagonist; Muscarinic acetylcholine receptor M3 antagonist; Muscarinic acetylcholine receptor M1 antagonist; Muscarinic acetylcholine receptor M3 antagonist,ATROPINE; ATROPINE SULFATE; IPRATROPIUM BROMIDE; ISOPROPAMIDE IODIDE; OXYBUTYNIN,allergic rhinitis; atopic eczema; seasonal allergic rhinitis,5,3,immune system disorder,APPROVAL,1
CHRM3,AGONIST,Muscarinic acetylcholine receptor M1 agonist; Muscarinic acetylcholine receptor M3 agonist,CEVIMELINE; PILOCARPINE,Sjogren syndrome,2,1,immune system disorder,APPROVAL,1
ARAF,INHIBITOR,RAF serine/threonine protein kinase inhibitor,TOVORAFENIB,Langerhans cell histiocytosis; hairy cell leukemia,1,2,immune system disorder,APPROVAL,1
ADRB3,AGONIST,Adrenergic receptor agonist; Beta-3 adrenergic receptor agonist,DROXIDOPA; EPHEDRINE HYDROCHLORIDE; EPINEPHRINE; MIRABEGRON,acquired polycythemia vera; allergic disease; allergic rhinitis; anaphylaxis; diffuse large B-cell lymphoma; essential thrombocythemia; myalgic encephalomeyelitis/chronic fatigue syndrome; myeloproliferative neoplasm; primary myelofibrosis; seasonal allergic rhinitis; type 1 diabetes mellitus; type III hypersensitivity disease,4,12,immune system disorder,APPROVAL,1
ADRB3,ANTAGONIST,Adrenergic receptor alpha-1 antagonist; Adrenergic receptor beta antagonist,CARVEDILOL,anaphylaxis; rheumatoid arthritis; type 1 diabetes mellitus,1,3,immune system disorder,APPROVAL,1
INSR,AGONIST,Insulin receptor agonist,INSULIN ASPART; INSULIN DEGLUDEC; INSULIN DETEMIR; INSULIN GLARGINE; INSULIN GLULISINE; INSULIN HUMAN; INSULIN ICODEC; INSULIN LISPRO; INSULIN PORK,Burkitt lymphoma; Sjogren syndrome; latent autoimmune diabetes in adults; multiple sclerosis; pemphigus vulgaris; rheumatoid arthritis; type 1 diabetes mellitus,9,7,immune system disorder,APPROVAL,1
PSMD7,INHIBITOR,26S proteasome inhibitor,BORTEZOMIB; BORTEZOMIB D-MANNITOL; CARFILZOMIB; IXAZOMIB; IXAZOMIB CITRATE,"AIDS; B-cell adult acute lymphocytic leukemia; B-cell childhood acute lymphoblastic leukemia; B-cell chronic lymphocytic leukemia; B-cell non-Hodgkin lymphoma; Burkitt lymphoma; Evans syndrome; MALT lymphoma; POEMS syndrome; T-cell acute lymphoblastic leukemia; T-cell adult acute lymphocytic leukemia; T-cell prolymphocytic leukemia; Waldenstrom macroglobulinemia; acquired adult-onset immunodeficiency; acute graft versus host disease; acute myeloid leukemia; acute myeloid leukemia by FAB classification; acute promyelocytic leukemia; adult T-cell leukemia/lymphoma; autoimmune encephalitis; autoimmune hemolytic anemia; autoimmune thrombocytopenic purpura; bone marrow cancer; chronic graft versus host disease; chronic myelogenous leukemia, BCR-ABL1 positive; chronic myelomonocytic leukemia; cold agglutinin disease; diffuse large B-cell lymphoma; follicular lymphoma; graft versus host disease; indolent B-cell non-Hodgkin lymphoma; lymphoplasmacytic lymphoma; mantle cell lymphoma; marginal zone lymphoma; mastocytosis; mixed phenotype acute leukemia; multiple sclerosis; myasthenia gravis; myelofibrosis; myeloid leukemia; neoplasm of mature B-cells; plasma cell leukemia; plasma cell myeloma; plasmacytoma; precursor B-cell acute lymphoblastic leukemia; primary effusion lymphoma; rheumatoid arthritis; smoldering plasma cell myeloma; systemic lupus erythematosus; systemic sclerosis",5,50,immune system disorder,APPROVAL,1
ADRA1A,ANTAGONIST,Adrenergic receptor alpha antagonist; Adrenergic receptor alpha-1 antagonist; Adrenergic receptor beta antagonist,CARVEDILOL; PHENTOLAMINE,anaphylaxis; rheumatoid arthritis; type 1 diabetes mellitus,2,3,immune system disorder,APPROVAL,1
ADRA1A,AGONIST,Adrenergic receptor agonist; Adrenergic receptor alpha agonist; Adrenergic receptor alpha-1 agonist,ALFUZOSIN; DROXIDOPA; EPHEDRINE HYDROCHLORIDE; EPINEPHRINE; NAPHAZOLINE; NAPHAZOLINE HYDROCHLORIDE; OXYMETAZOLINE; OXYMETAZOLINE HYDROCHLORIDE; PHENYLEPHRINE; PHENYLEPHRINE HYDROCHLORIDE; TETRAHYDROZOLINE; XYLOMETAZOLINE,allergic disease; allergic rhinitis; anaphylaxis; atopic conjunctivitis; eye allergy; multiple sclerosis; myalgic encephalomeyelitis/chronic fatigue syndrome; seasonal allergic rhinitis; type 1 diabetes mellitus; type III hypersensitivity disease,12,10,immune system disorder,APPROVAL,1
EEF2,INHIBITOR; BINDING AGENT,Elongation factor 2 inhibitor; CD22 binding agent; Elongation factor 2 inhibitor; Interleukin-3 receptor subunit alpha binding agent,MOXETUMOMAB PASUDOTOX; TAGRAXOFUSP,B-cell chronic lymphocytic leukemia; acute myeloid leukemia; acute myeloid leukemia by FAB classification; chronic myelomonocytic leukemia; diffuse large B-cell lymphoma; follicular lymphoma; hairy cell leukemia; mantle cell lymphoma; myelofibrosis; myeloproliferative neoplasm; plasma cell myeloma,2,11,immune system disorder,APPROVAL,1
EEF2,BINDING AGENT; INHIBITOR,Interleukin-2 receptor binding agent; Elongation factor 2 inhibitor,DENILEUKIN DIFTITOX,B-cell chronic lymphocytic leukemia; acute graft versus host disease; acute myeloid leukemia; adult T-cell leukemia/lymphoma; diffuse large B-cell lymphoma; follicular lymphoma; systemic mastocytosis,1,7,immune system disorder,APPROVAL,1
SMO,INHIBITOR,Smoothened homolog inhibitor,SONIDEGIB; VISMODEGIB,"B-cell chronic lymphocytic leukemia; acute myeloid leukemia; chronic graft versus host disease; chronic myelogenous leukemia, BCR-ABL1 positive; chronic myelomonocytic leukemia; diffuse large B-cell lymphoma; graft versus host disease; myelofibrosis; myeloproliferative neoplasm; plasma cell myeloma; primary central nervous system lymphoma",2,11,immune system disorder,APPROVAL,1
SMO,ANTAGONIST,Smoothened homolog antagonist,GLASDEGIB; GLASDEGIB MALEATE,"acute myeloid leukemia; acute myeloid leukemia by FAB classification; chronic graft versus host disease; chronic myelogenous leukemia, BCR-ABL1 positive; chronic myelomonocytic leukemia; juvenile myelomonocytic leukemia; myelofibrosis; myeloid sarcoma",2,8,immune system disorder,APPROVAL,1
