Target (Gene),Action Type,Action,Drug Name,Specific Disease,num_drugs,num_diseases,Broad Category,maxClinicalStage,immune_indication
FLT1,INHIBITOR,Discoidin domain-containing receptor 2 inhibitor; Ephrin type-A receptor 2 inhibitor; Fibroblast growth factor receptor 2 inhibitor; MAP kinase p38 beta inhibitor; Platelet-derived growth factor receptor inhibitor; Serine/threonine-protein kinase B-raf inhibitor; Stem cell growth factor receptor inhibitor; Tyrosine-protein kinase TIE-2 inhibitor; Fibroblast growth factor receptor 1 inhibitor; Nerve growth factor receptor Trk-A inhibitor; Serine/threonine-protein kinase RAF inhibitor; Tyrosine-protein kinase ABL inhibitor; Tyrosine-protein kinase FRK inhibitor; Tyrosine-protein kinase receptor RET inhibitor; Vascular endothelial growth factor receptor inhibitor; Ephrin receptor inhibitor; Tyrosine-protein kinase BRK inhibitor; Tyrosine-protein kinase receptor RET inhibitor; Vascular endothelial growth factor receptor inhibitor; Epidermal growth factor receptor inhibitor; Tyrosine-protein kinase SRC inhibitor; Tyrosine-protein kinase TIE-2 inhibitor; Fibroblast growth factor receptor 1 inhibitor; Fibroblast growth factor receptor 3 inhibitor; Macrophage colony stimulating factor receptor inhibitor; Platelet-derived growth factor receptor inhibitor; Stem cell growth factor receptor inhibitor; Tyrosine-protein kinase ITK/TSK inhibitor; Tyrosine-protein kinase LCK inhibitor; Vascular endothelial growth factor receptor inhibitor; Macrophage colony stimulating factor receptor inhibitor; Stem cell growth factor receptor inhibitor; Vascular endothelial growth factor receptor 1 inhibitor; Vascular endothelial growth factor receptor 2 inhibitor; Vascular endothelial growth factor receptor inhibitor; Platelet-derived growth factor receptor alpha inhibitor; Platelet-derived growth factor receptor beta inhibitor; Platelet-derived growth factor receptor inhibitor; Tyrosine-protein kinase receptor FLT3 inhibitor; Tyrosine-protein kinase receptor RET inhibitor; Vascular endothelial growth factor receptor 3 inhibitor; Platelet-derived growth factor receptor inhibitor; Vascular endothelial growth factor receptor inhibitor; Fibroblast growth factor receptor inhibitor; Serine/threonine-protein kinase RAF inhibitor; Platelet-derived growth factor receptor beta inhibitor; Serine/threonine-protein kinase B-raf inhibitor; Stem cell growth factor receptor inhibitor; Tyrosine-protein kinase receptor FLT3 inhibitor; Tyrosine-protein kinase receptor RET inhibitor; Vascular endothelial growth factor receptor inhibitor; Vascular endothelial growth factor receptor inhibitor; Vascular endothelial growth factor receptor inhibitor; Macrophage colony stimulating factor receptor inhibitor; Platelet-derived growth factor receptor inhibitor; Stem cell growth factor receptor inhibitor; Tyrosine-protein kinase receptor FLT3 inhibitor; Tyrosine-protein kinase receptor RET inhibitor; Vascular endothelial growth factor receptor inhibitor; Platelet-derived growth factor receptor inhibitor; Stem cell growth factor receptor inhibitor,AXITINIB; CEDIRANIB; LENVATINIB; NINTEDANIB; NINTEDANIB ESYLATE; PAZOPANIB; REGORAFENIB; SORAFENIB; SORAFENIB TOSYLATE; SUNITINIB; SUNITINIB MALATE; VANDETANIB,"B-cell chronic lymphocytic leukemia; acute leukemia of ambiguous lineage; acute monocytic leukemia; acute myeloid leukemia; acute promyelocytic leukemia; chronic myelogenous leukemia, BCR-ABL1 positive; chronic myelomonocytic leukemia; diffuse large B-cell lymphoma; limited cutaneous systemic sclerosis; lymphedema; mantle cell lymphoma; mixed phenotype acute leukemia; myeloid leukemia; myeloproliferative neoplasm; plasma cell myeloma; primary myelofibrosis; psoriasis; systemic sclerosis; thymic carcinoma; thymoma; type 1 diabetes mellitus",12,21,immune system disorder,APPROVAL,1
EPOR,AGONIST,Erythropoietin receptor agonist,DARBEPOETIN ALFA; EPOETIN ALFA; EPOETIN BETA; METHOXY POLYETHYLENE GLYCOL-EPOETIN BETA,AIDS; B-cell chronic lymphocytic leukemia; acute myeloid leukemia; autoimmune hemolytic anemia; autoimmune hepatitis; autoimmune thrombocytopenic purpura; chronic myelomonocytic leukemia; diffuse large B-cell lymphoma; multiple sclerosis; plasma cell myeloma; rheumatoid arthritis; type 1 diabetes mellitus,4,12,immune system disorder,APPROVAL,1
NDUFB9,INHIBITOR,Mitochondrial complex I (NADH dehydrogenase) inhibitor; Mitochondrial glycerol-3-phosphate dehydrogenase inhibitor,METFORMIN; METFORMIN HYDROCHLORIDE,B-cell chronic lymphocytic leukemia; Fanconi anemia; Graves ophthalmopathy; acute myeloid leukemia; diffuse large B-cell lymphoma; follicular lymphoma; latent autoimmune diabetes in adults; multiple sclerosis; myalgic encephalomeyelitis/chronic fatigue syndrome; plasma cell myeloma; psoriasis; psoriasis vulgaris; psoriatic arthritis; rheumatoid arthritis; type 1 diabetes mellitus; ulcerative colitis; vitiligo,2,17,immune system disorder,APPROVAL,1
GABRP,POSITIVE ALLOSTERIC MODULATOR,GABA-A receptor; anion channel positive allosteric modulator,ALPRAZOLAM; DIAZEPAM; ESZOPICLONE; MIDAZOLAM; PROPOFOL,acute myeloid leukemia; atopic eczema; hypersensitivity reaction disease; hypersplenism; multiple sclerosis; rheumatoid arthritis; type 1 diabetes mellitus,5,7,immune system disorder,APPROVAL,1
GABRP,ANTAGONIST; BLOCKER; INHIBITOR; POSITIVE MODULATOR,Glutamate receptor ionotropic AMPA antagonist; Glutamate receptor ionotropic kainate antagonist; Sodium channel alpha subunit blocker; Carbonic anhydrase II inhibitor; Carbonic anhydrase IV inhibitor; GABA-A receptor; anion channel positive modulator,TOPIRAMATE,multiple sclerosis; ulcerative colitis,1,2,immune system disorder,APPROVAL,1
GABRP,ANTAGONIST,GABA-A receptor; anion channel antagonist,ETIFOXINE,multiple sclerosis,1,1,immune system disorder,APPROVAL,1
GABRP,OPENER; POSITIVE ALLOSTERIC MODULATOR; POSITIVE MODULATOR,Potassium channel subfamily K member 10 opener; Potassium channel subfamily K member 18 opener; Potassium channel subfamily K member 2 opener; Potassium channel subfamily K member 9 opener; GABA-A receptor; anion channel positive allosteric modulator; Glycine receptor (alpha-1/beta) positive modulator; Potassium channel subfamily K member 3 opener,DESFLURANE,hypersplenism,1,1,immune system disorder,APPROVAL,1
NTRK3,INHIBITOR,ALK tyrosine kinase receptor inhibitor; Neurotrophic tyrosine kinase receptor inhibitor; Proto-oncogene tyrosine-protein kinase ROS inhibitor; Nerve growth factor receptor Trk-A inhibitor; Neurotrophic tyrosine kinase receptor type 2 inhibitor; Tyrosine-protein kinase receptor FLT3 inhibitor; NT-3 growth factor receptor inhibitor; Tyrosine-protein kinase JAK2 inhibitor; Tyrosine-protein kinase receptor RET inhibitor; Neurotrophic tyrosine kinase receptor inhibitor,ENTRECTINIB; LAROTRECTINIB; LESTAURTINIB,acquired polycythemia vera; acute myeloid leukemia; acute myeloid leukemia by FAB classification; essential thrombocythemia; myelofibrosis; myeloid leukemia; plasma cell myeloma; psoriasis; psoriasis vulgaris,3,9,immune system disorder,APPROVAL,1
FRK,INHIBITOR,Bcr/Abl fusion protein inhibitor; Ephrin type-A receptor 2 inhibitor; Platelet-derived growth factor receptor beta inhibitor; SRC inhibitor; Stem cell growth factor receptor inhibitor; Tyrosine-protein kinase ABL inhibitor; Discoidin domain-containing receptor 2 inhibitor; Ephrin type-A receptor 2 inhibitor; Fibroblast growth factor receptor 2 inhibitor; MAP kinase p38 beta inhibitor; Platelet-derived growth factor receptor inhibitor; Serine/threonine-protein kinase B-raf inhibitor; Stem cell growth factor receptor inhibitor; Tyrosine-protein kinase TIE-2 inhibitor; Fibroblast growth factor receptor 1 inhibitor; Nerve growth factor receptor Trk-A inhibitor; Serine/threonine-protein kinase RAF inhibitor; Tyrosine-protein kinase ABL inhibitor; Tyrosine-protein kinase FRK inhibitor; Tyrosine-protein kinase receptor RET inhibitor; Vascular endothelial growth factor receptor inhibitor,DASATINIB ANHYDROUS; REGORAFENIB,"B-cell adult acute lymphocytic leukemia; B-cell childhood acute lymphoblastic leukemia; B-cell chronic lymphocytic leukemia; T-cell acute lymphoblastic leukemia; T-cell adult acute lymphocytic leukemia; Waldenstrom macroglobulinemia; acquired polycythemia vera; acute myeloid leukemia; blast phase chronic myelogenous leukemia, BCR-ABL1 positive; chronic myelogenous leukemia, BCR-ABL1 positive; diffuse large B-cell lymphoma; myeloproliferative neoplasm; plasma cell myeloma; precursor B-cell acute lymphoblastic leukemia; systemic mastocytosis; thymic carcinoma; thymoma",2,17,immune system disorder,APPROVAL,1
ALK,INHIBITOR,ALK tyrosine kinase receptor inhibitor; EML4-ALK inhibitor; ALK tyrosine kinase receptor inhibitor; Neurotrophic tyrosine kinase receptor inhibitor; Proto-oncogene tyrosine-protein kinase ROS inhibitor; EML4-ALK inhibitor; NPM/ALK (Nucleophosmin/ALK tyrosine kinase receptor) inhibitor; ALK tyrosine kinase receptor inhibitor; Hepatocyte growth factor receptor inhibitor; Macrophage-stimulating protein receptor inhibitor; Proto-oncogene tyrosine-protein kinase ROS inhibitor; EML4-ALK inhibitor; Tyrosine-protein kinase receptor RET inhibitor; ALK tyrosine kinase receptor inhibitor,ALECTINIB; CRIZOTINIB; ENTRECTINIB; LORLATINIB,acute myeloid leukemia; plasma cell myeloma,4,2,immune system disorder,APPROVAL,1
MC2R,AGONIST,Melanocortin receptor 2 agonist,CORTICOTROPIN; CORTICOTROPIN ZINC HYDROXIDE,multiple sclerosis; rheumatoid arthritis; ulcerative colitis,2,3,immune system disorder,APPROVAL,1
SRMS,INHIBITOR,Bcr/Abl fusion protein inhibitor; Ephrin type-A receptor 2 inhibitor; Platelet-derived growth factor receptor beta inhibitor; SRC inhibitor; Stem cell growth factor receptor inhibitor; Tyrosine-protein kinase ABL inhibitor,DASATINIB ANHYDROUS,"B-cell adult acute lymphocytic leukemia; B-cell childhood acute lymphoblastic leukemia; B-cell chronic lymphocytic leukemia; T-cell acute lymphoblastic leukemia; T-cell adult acute lymphocytic leukemia; Waldenstrom macroglobulinemia; acquired polycythemia vera; acute myeloid leukemia; blast phase chronic myelogenous leukemia, BCR-ABL1 positive; chronic myelogenous leukemia, BCR-ABL1 positive; diffuse large B-cell lymphoma; plasma cell myeloma; precursor B-cell acute lymphoblastic leukemia; systemic mastocytosis",1,14,immune system disorder,APPROVAL,1
ERBB3,INHIBITOR,Ephrin receptor inhibitor; Tyrosine-protein kinase BRK inhibitor; Tyrosine-protein kinase receptor RET inhibitor; Vascular endothelial growth factor receptor inhibitor; Epidermal growth factor receptor inhibitor; Tyrosine-protein kinase SRC inhibitor; Tyrosine-protein kinase TIE-2 inhibitor,VANDETANIB,acute myeloid leukemia; plasma cell myeloma,1,2,immune system disorder,APPROVAL,1
CDK6,INHIBITOR,Cyclin-dependent kinase 4/cyclin D1 inhibitor; CDK6/cyclin D1 inhibitor; Cyclin-dependent kinase 6 inhibitor; Cyclin-dependent kinase 4 inhibitor,ABEMACICLIB; PALBOCICLIB; TRILACICLIB,acute myeloid leukemia; diffuse large B-cell lymphoma; mantle cell lymphoma; myelofibrosis; plasma cell myeloma; primary central nervous system lymphoma; thymic epithelial neoplasm,3,7,immune system disorder,APPROVAL,1
GSR,INHIBITOR,Glutathione reductase inhibitor,CARMUSTINE,"B-cell chronic lymphocytic leukemia; B-cell non-Hodgkin lymphoma; POEMS syndrome; Waldenstrom macroglobulinemia; acute myeloid leukemia; autoimmune disorder of the nervous system; central nervous system non-hodgkin lymphoma; chronic myelogenous leukemia, BCR-ABL1 positive; diffuse large B-cell lymphoma; follicular lymphoma; graft versus host disease; mantle cell lymphoma; multiple sclerosis; plasma cell myeloma; primary central nervous system lymphoma",1,15,immune system disorder,APPROVAL,1
IL5,INHIBITOR,Interleukin-5 inhibitor,DEPEMOKIMAB; MEPOLIZUMAB; RESLIZUMAB,allergic asthma; atopic eczema; bullous pemphigoid; eosinophilic granulomatosis with polyangiitis; granulomatosis with polyangiitis; hypereosinophilic syndrome,3,6,immune system disorder,APPROVAL,1
GABBR2,AGONIST,GABA-B receptor agonist,BACLOFEN,ataxia telangiectasia; multiple sclerosis,1,2,immune system disorder,APPROVAL,1
HDAC10,INHIBITOR,Histone deacetylase inhibitor,BELINOSTAT; ENTINOSTAT; GIVINOSTAT; GIVINOSTAT HYDROCHLORIDE; PANOBINOSTAT; PANOBINOSTAT LACTATE; ROMIDEPSIN,"B-cell chronic lymphocytic leukemia; B-cell non-Hodgkin lymphoma; Crohn disease; T-cell acute lymphoblastic leukemia; Waldenstrom macroglobulinemia; acquired polycythemia vera; acute myeloid leukemia; adult T-cell leukemia/lymphoma; chronic myelogenous leukemia, BCR-ABL1 positive; chronic myelomonocytic leukemia; diffuse large B-cell lymphoma; essential thrombocythemia; follicular lymphoma; graft versus host disease; indolent B-cell non-Hodgkin lymphoma; lymphoplasmacytic lymphoma; mantle cell lymphoma; myelofibrosis; plasma cell myeloma; primary myelofibrosis; thymic carcinoma; thymoma",7,22,immune system disorder,APPROVAL,1
HDAC11,INHIBITOR,Histone deacetylase inhibitor,BELINOSTAT; ENTINOSTAT; GIVINOSTAT; GIVINOSTAT HYDROCHLORIDE; PANOBINOSTAT; PANOBINOSTAT LACTATE; ROMIDEPSIN,"B-cell chronic lymphocytic leukemia; B-cell non-Hodgkin lymphoma; Crohn disease; T-cell acute lymphoblastic leukemia; Waldenstrom macroglobulinemia; acquired polycythemia vera; acute myeloid leukemia; adult T-cell leukemia/lymphoma; chronic myelogenous leukemia, BCR-ABL1 positive; chronic myelomonocytic leukemia; diffuse large B-cell lymphoma; essential thrombocythemia; follicular lymphoma; graft versus host disease; indolent B-cell non-Hodgkin lymphoma; lymphoplasmacytic lymphoma; mantle cell lymphoma; myelofibrosis; plasma cell myeloma; primary myelofibrosis; thymic carcinoma; thymoma",7,22,immune system disorder,APPROVAL,1
CSNK1E,INHIBITOR,Casein kinase I epsilon inhibitor; PI3-kinase p110-delta subunit inhibitor; Tyrosine-protein kinase ABL inhibitor,UMBRALISIB; UMBRALISIB TOSYLATE,B-cell chronic lymphocytic leukemia; B-cell non-Hodgkin lymphoma; Waldenstrom macroglobulinemia; acquired polycythemia vera; diffuse large B-cell lymphoma; follicular lymphoma; mantle cell lymphoma; marginal zone lymphoma; myelodysplastic/myeloproliferative neoplasm; neoplasm of mature B-cells; primary myelofibrosis,2,11,immune system disorder,APPROVAL,1
HDAC5,INHIBITOR,Histone deacetylase inhibitor,BELINOSTAT; ENTINOSTAT; GIVINOSTAT; GIVINOSTAT HYDROCHLORIDE; PANOBINOSTAT; PANOBINOSTAT LACTATE; ROMIDEPSIN,"B-cell chronic lymphocytic leukemia; B-cell non-Hodgkin lymphoma; Crohn disease; T-cell acute lymphoblastic leukemia; Waldenstrom macroglobulinemia; acquired polycythemia vera; acute myeloid leukemia; adult T-cell leukemia/lymphoma; chronic myelogenous leukemia, BCR-ABL1 positive; chronic myelomonocytic leukemia; diffuse large B-cell lymphoma; essential thrombocythemia; follicular lymphoma; graft versus host disease; indolent B-cell non-Hodgkin lymphoma; lymphoplasmacytic lymphoma; mantle cell lymphoma; myelofibrosis; plasma cell myeloma; primary myelofibrosis; thymic carcinoma; thymoma",7,22,immune system disorder,APPROVAL,1
NDUFA6,INHIBITOR,Mitochondrial complex I (NADH dehydrogenase) inhibitor; Mitochondrial glycerol-3-phosphate dehydrogenase inhibitor,METFORMIN; METFORMIN HYDROCHLORIDE,B-cell chronic lymphocytic leukemia; Fanconi anemia; Graves ophthalmopathy; acute myeloid leukemia; diffuse large B-cell lymphoma; follicular lymphoma; latent autoimmune diabetes in adults; multiple sclerosis; myalgic encephalomeyelitis/chronic fatigue syndrome; plasma cell myeloma; psoriasis; psoriasis vulgaris; psoriatic arthritis; rheumatoid arthritis; type 1 diabetes mellitus; ulcerative colitis; vitiligo,2,17,immune system disorder,APPROVAL,1
ESR1,MODULATOR,Estrogen receptor alpha modulator; Estrogen receptor modulator,BAZEDOXIFENE; BAZEDOXIFENE ACETATE; ESTRIOL; TAMOXIFEN,IgG4-related retroperitoneal fibrosis; diffuse large B-cell lymphoma; multiple sclerosis; plasma cell myeloma; relapsing-remitting multiple sclerosis,4,5,immune system disorder,APPROVAL,1
ESR1,ANTAGONIST; DEGRADER,Estrogen receptor alpha antagonist; Estrogen receptor degrader,FULVESTRANT,acute myeloid leukemia; systemic lupus erythematosus,1,2,immune system disorder,APPROVAL,1
ESR1,AGONIST,Estrogen receptor agonist; Estrogen receptor alpha agonist,"ESTRADIOL; ESTROGENS, CONJUGATED; ETHINYL ESTRADIOL",multiple sclerosis; systemic lupus erythematosus; type 1 diabetes mellitus,3,3,immune system disorder,APPROVAL,1
NDUFC1,INHIBITOR,Mitochondrial complex I (NADH dehydrogenase) inhibitor; Mitochondrial glycerol-3-phosphate dehydrogenase inhibitor,METFORMIN; METFORMIN HYDROCHLORIDE,B-cell chronic lymphocytic leukemia; Fanconi anemia; Graves ophthalmopathy; acute myeloid leukemia; diffuse large B-cell lymphoma; follicular lymphoma; latent autoimmune diabetes in adults; multiple sclerosis; myalgic encephalomeyelitis/chronic fatigue syndrome; plasma cell myeloma; psoriasis; psoriasis vulgaris; psoriatic arthritis; rheumatoid arthritis; type 1 diabetes mellitus; ulcerative colitis; vitiligo,2,17,immune system disorder,APPROVAL,1
GPRC5D,BINDING AGENT,G-protein coupled receptor family C group 5 member D binding agent; T cell surface glycoprotein CD3 binding agent,TALQUETAMAB,myasthenia gravis; plasma cell myeloma,1,2,immune system disorder,APPROVAL,1
CD274,INHIBITOR,Programmed cell death 1 ligand 1 inhibitor,ATEZOLIZUMAB; COSIBELIMAB; DURVALUMAB,"AIDS; B-cell chronic lymphocytic leukemia; B-cell non-Hodgkin lymphoma; Burkitt lymphoma; MALT lymphoma; Waldenstrom macroglobulinemia; acute myeloid leukemia; acute myeloid leukemia by FAB classification; allergic rhinitis; chronic myelogenous leukemia, BCR-ABL1 positive; chronic myelomonocytic leukemia; diffuse large B-cell lymphoma; follicular lymphoma; high grade B-cell lymphoma; mantle cell lymphoma; myelofibrosis; neoplasm of mature B-cells; plasma cell myeloma; plasmacytoma; primary central nervous system lymphoma; seasonal allergic rhinitis; thymic carcinoma",3,22,immune system disorder,APPROVAL,1
CD274,OTHER,Programmed cell death 1 ligand 1 other,AVELUMAB,"T-cell leukemia; acute myeloid leukemia; chronic myelogenous leukemia, BCR-ABL1 positive; diffuse large B-cell lymphoma; follicular lymphoma; mantle cell lymphoma; plasma cell myeloma; plasmacytoma; primary myelofibrosis; thymic carcinoma; thymoma",1,11,immune system disorder,APPROVAL,1
CCDC6,INHIBITOR,Coiled-coil domain-containing protein 6/Tyrosine-protein kinase receptor RET inhibitor; Tyrosine-protein kinase receptor RET inhibitor; Kinesin-1 heavy chain/ Tyrosine-protein kinase receptor RET inhibitor,SELPERCATINIB,plasma cell myeloma,1,1,immune system disorder,APPROVAL,1
NDUFA5,INHIBITOR,Mitochondrial complex I (NADH dehydrogenase) inhibitor; Mitochondrial glycerol-3-phosphate dehydrogenase inhibitor,METFORMIN; METFORMIN HYDROCHLORIDE,B-cell chronic lymphocytic leukemia; Fanconi anemia; Graves ophthalmopathy; acute myeloid leukemia; diffuse large B-cell lymphoma; follicular lymphoma; latent autoimmune diabetes in adults; multiple sclerosis; myalgic encephalomeyelitis/chronic fatigue syndrome; plasma cell myeloma; psoriasis; psoriasis vulgaris; psoriatic arthritis; rheumatoid arthritis; type 1 diabetes mellitus; ulcerative colitis; vitiligo,2,17,immune system disorder,APPROVAL,1
IL31RA,INHIBITOR,Interleukin-31 receptor subunit alpha inhibitor,NEMOLIZUMAB,atopic eczema; psoriasis; systemic sclerosis,1,3,immune system disorder,APPROVAL,1
DRD2,ANTAGONIST,D2-like dopamine receptor antagonist; Serotonin 2c (5-HT2c) receptor antagonist; Serotonin 2a (5-HT2a) receptor antagonist; Dopamine D2 receptor antagonist; Serotonin 2a (5-HT2a) receptor antagonist; Dopamine D2 receptor antagonist; Serotonin 2c (5-HT2c) receptor antagonist; Serotonin 2a (5-HT2a) receptor antagonist; Serotonin 2c (5-HT2c) receptor antagonist; Dopamine D2 receptor antagonist,DOMPERIDONE; FLUPHENAZINE; FLUPHENAZINE DECANOATE; FLUPHENAZINE HYDROCHLORIDE; QUETIAPINE FUMARATE; RISPERIDONE; THIETHYLPERAZINE; THIORIDAZINE,22q11.2 deletion syndrome; acute myeloid leukemia; allergic disease; multiple sclerosis; plasma cell myeloma; psoriasis; systemic sclerosis; type 1 diabetes mellitus,8,8,immune system disorder,APPROVAL,1
DRD2,ANTAGONIST; AGONIST,Dopamine D2 receptor antagonist; Serotonin 4 (5-HT4) receptor agonist; Serotonin 3a (5-HT3a) receptor antagonist,METOCLOPRAMIDE,type 1 diabetes mellitus,1,1,immune system disorder,APPROVAL,1
DRD2,ANTAGONIST; INVERSE AGONIST,Serotonin 2a (5-HT2a) receptor antagonist; D2-like dopamine receptor inverse agonist,HALOPERIDOL,rheumatic fever,1,1,immune system disorder,APPROVAL,1
DRD2,AGONIST,D2-like dopamine receptor agonist,BROMOCRIPTINE,type 1 diabetes mellitus,1,1,immune system disorder,APPROVAL,1
TSLP,INHIBITOR,Thymic stromal lymphopoietin inhibitor,TEZEPELUMAB,allergic disease; allergic rhinitis; atopic eczema; eosinophilic granulomatosis with polyangiitis; peanut allergic reaction,1,5,immune system disorder,APPROVAL,1
GCGR,AGONIST,Glucagon receptor agonist,DASIGLUCAGON; DASIGLUCAGON HYDROCHLORIDE; GLUCAGON,type 1 diabetes mellitus,3,1,immune system disorder,APPROVAL,1
PPP3CA,INHIBITOR,"Serine/threonine protein phosphatase 2B catalytic subunit, alpha isoform inhibitor",VOCLOSPORIN,immune system disorder; lupus erythematosus; psoriasis vulgaris; systemic lupus erythematosus,1,4,immune system disorder,APPROVAL,1
NDUFV1,INHIBITOR,Mitochondrial complex I (NADH dehydrogenase) inhibitor; Mitochondrial glycerol-3-phosphate dehydrogenase inhibitor,METFORMIN; METFORMIN HYDROCHLORIDE,B-cell chronic lymphocytic leukemia; Fanconi anemia; Graves ophthalmopathy; acute myeloid leukemia; diffuse large B-cell lymphoma; follicular lymphoma; latent autoimmune diabetes in adults; multiple sclerosis; myalgic encephalomeyelitis/chronic fatigue syndrome; plasma cell myeloma; psoriasis; psoriasis vulgaris; psoriatic arthritis; rheumatoid arthritis; type 1 diabetes mellitus; ulcerative colitis; vitiligo,2,17,immune system disorder,APPROVAL,1
BRD2,INHIBITOR,Bromodomain and extra-terminal motif (BET) inhibitor,PELABRESIB,acute myeloid leukemia by FAB classification; essential thrombocythemia; myelodysplastic/myeloproliferative neoplasm; myelofibrosis; myeloproliferative neoplasm; plasma cell myeloma; primary myelofibrosis,1,7,immune system disorder,APPROVAL,1
PDE10A,ANTAGONIST; INHIBITOR,"Adenosine A2 receptor antagonist; 3',5'-cyclic phosphodiesterase inhibitor",PENTOXIFYLLINE,AIDS; inflammatory bowel disease; lymphedema; rheumatoid arthritis; type 1 diabetes mellitus; ulcerative colitis,1,6,immune system disorder,APPROVAL,1
PDE10A,INHIBITOR,"3',5'-cyclic phosphodiesterase inhibitor; Equilibrative nucleoside transporter 1 inhibitor; Phosphodiesterase 10A inhibitor; Phosphodiesterase 3A inhibitor; Phosphodiesterase 4 inhibitor; Phosphodiesterase 5A inhibitor",DIPYRIDAMOLE; IBUDILAST,Castleman disease; multiple sclerosis; rheumatoid arthritis,2,3,immune system disorder,APPROVAL,1
TGFB1,INHIBITOR,Transforming growth factor beta inhibitor,LUSPATERCEPT,autoimmune hemolytic anemia; autoimmune thrombocytopenic purpura; myelofibrosis; primary myelofibrosis,1,4,immune system disorder,APPROVAL,1
HRH2,ANTAGONIST,Histamine H2 receptor antagonist,CIMETIDINE; FAMOTIDINE; RANITIDINE,atopic eczema; diffuse large B-cell lymphoma; hyper-IgE syndrome; rheumatoid arthritis,3,4,immune system disorder,APPROVAL,1
ERBB2,INHIBITOR,Ephrin receptor inhibitor; Tyrosine-protein kinase BRK inhibitor; Tyrosine-protein kinase receptor RET inhibitor; Vascular endothelial growth factor receptor inhibitor; Epidermal growth factor receptor inhibitor; Tyrosine-protein kinase SRC inhibitor; Tyrosine-protein kinase TIE-2 inhibitor; Epidermal growth factor receptor erbB1 inhibitor; Receptor protein-tyrosine kinase erbB-2 inhibitor; Epidermal growth factor receptor erbB1 inhibitor; Receptor protein-tyrosine kinase erbB-2 inhibitor; Receptor protein-tyrosine kinase erbB-4 inhibitor; Receptor protein-tyrosine kinase erbB-2 inhibitor; Receptor protein-tyrosine kinase erbB-4 inhibitor; Epidermal growth factor receptor erbB1 inhibitor; Receptor protein-tyrosine kinase erbB-2 inhibitor,AFATINIB; LAPATINIB; NERATINIB; PERTUZUMAB; TRASTUZUMAB; TUCATINIB; VANDETANIB,"B-cell adult acute lymphocytic leukemia; B-cell childhood acute lymphoblastic leukemia; Crohn disease; Waldenstrom macroglobulinemia; acute myeloid leukemia; ankylosing spondylitis; chronic myelogenous leukemia, BCR-ABL1 positive; mantle cell lymphoma; plasma cell myeloma; precursor B-cell acute lymphoblastic leukemia; rheumatoid arthritis; ulcerative colitis",7,12,immune system disorder,APPROVAL,1
ERBB2,BINDING AGENT; INHIBITOR,Receptor protein-tyrosine kinase erbB-2 binding agent; DNA topoisomerase I inhibitor; Receptor protein-tyrosine kinase erbB-2 binding agent; Tubulin inhibitor,TRASTUZUMAB DERUXTECAN; TRASTUZUMAB EMTANSINE,neutropenia; plasma cell myeloma,2,2,immune system disorder,APPROVAL,1
TNFRSF8,INHIBITOR; BINDING AGENT,Tubulin inhibitor; Tumor necrosis factor receptor superfamily member 8 binding agent,BRENTUXIMAB VEDOTIN,acute myeloid leukemia; adult T-cell leukemia/lymphoma; diffuse large B-cell lymphoma; diffuse scleroderma; follicular lymphoma; graft versus host disease; mast cell leukemia; systemic lupus erythematosus; systemic mastocytosis; systemic sclerosis,1,10,immune system disorder,APPROVAL,1
MET,INHIBITOR,EML4-ALK inhibitor; NPM/ALK (Nucleophosmin/ALK tyrosine kinase receptor) inhibitor; ALK tyrosine kinase receptor inhibitor; Hepatocyte growth factor receptor inhibitor; Macrophage-stimulating protein receptor inhibitor; Proto-oncogene tyrosine-protein kinase ROS inhibitor; Hepatocyte growth factor receptor inhibitor; Hepatocyte growth factor receptor inhibitor; Vascular endothelial growth factor receptor 2 inhibitor,CABOZANTINIB; CRIZOTINIB; TEPOTINIB,acute myeloid leukemia; plasma cell myeloma,3,2,immune system disorder,APPROVAL,1
UGCG,INHIBITOR,Ceramide glucosyltransferase inhibitor,MIGLUSTAT,AIDS; Niemann-Pick disease; Niemann-Pick disease type C,1,3,immune system disorder,APPROVAL,1
